Hash;Original;Tradução
"300db61";"Our house is perfectly alright. But maybe we should move soon.";"Nossa casa está perfeitamente bem. Mas talvez devêssemos nos mudar em breve."
"300db62";"Our house is perfectly alright. But maybe we should move soon.";"Nossa casa está perfeitamente bem. Mas talvez devêssemos nos mudar em breve."
"300db66";"Our house is perfectly alright. But maybe we should move soon.";"Nossa casa está perfeitamente bem. Mas talvez devêssemos nos mudar em breve."
"300db67";"I'm pretty pleased with our house. For now, anyway.";"Estou bem satisfeita com a nossa casa. Pelo menos por enquanto."
"3034760";"Our house is okay I guess. We could move though.";"Nossa casa é razoável, eu acho. Mas poderíamos nos mudar."
"c00e94b";"Our house is perfectly alright. But maybe we should move soon.";"Nossa casa está perfeitamente bem. Mas talvez devêssemos nos mudar em breve."
"c00e94c";"I'm pretty pleased with our house. For now anyway.";"Estou bastante satisfeito com nossa casa. Pelo menos por enquanto."
"c00e94d";"Our house is perfectly alright. But maybe we should move soon.";"Nossa casa está perfeitamente bem. Mas talvez devêssemos nos mudar em breve."
"c00e94f";"I have no complaints about a house. Do you, dear?";"Não tenho queixas da casa. E você, querida?"
"c07e1fe";"Our house is okay I guess. We could move though.";"Nossa casa é razoável, eu acho. Mas poderíamos nos mudar."
"fd0abce";"Who did the decoration in our place? Hobbes? Pull your finger out and do something about it, luv.";"Quem fez a decoração aqui? Hobbes? Se mexa e faça alguma coisa a respeito, querido(a)."
"fd0abcf";"Look at the quality of our furnishings some time, dear! Surely we can do better.";"Dê uma olhada na qualidade dos nossos móveis, querido(a)! Com certeza podemos fazer melhor."
"fd29625";"I'm embarrassed to have anyone round to our house. Our furniture is a disgrace, for starters.";"Tenho vergonha de receber visitas em casa. Para começar, nossos móveis são uma vergonha."
"2cc6dc81";"How long are we going to live in our hovel?";"Por quanto tempo vamos morar nessa pocilga?"
"2cc6dc82";"Couldn't we move somewhere nicer?";"Não poderíamos nos mudar para um lugar melhor?"
"2cc6dc84";"Our house is horrible. I'm tired of living in it.";"Nossa casa é horrível. Estou cansado de morar nela."
"2cc6dc85";"I didn't realise marrying you would mean living in such squalor.";"Eu não imaginava que casar com você significaria viver em tamanha miséria."
"2cc6dc86";"I don't know how you can expect me to live in a decaying hovel.";"Não sei como você espera que eu viva num casebre caindo aos pedaços."
"2cc6dc87";"I'm sick of living in a dump.";"Estou farto de viver num lixão."
"2cc818ac";"You know, we could move somewhere nicer.";"Sabe, poderíamos nos mudar para um lugar melhor."
"2e084f41";"We've got walls, floors... what more could we want?";"Temos paredes, pisos... o que mais poderíamos querer?"
"2e084f42";"Ahh, yes, our house will do nicely.";"Ah, sim, nossa casa servirá perfeitamente."
"2e084f43";"Our home is certainly more than adequate, don't you agree, dear?";"Nossa casa é mais do que adequada, não acha, querida?"
"2e084f44";"It is no castle, but I think we can be very happy in our house.";"Não é um castelo, mas acho que podemos ser muito felizes em nossa casa."
"2e084f46";"I'm quite happy living where we do. What about you, dear?";"Estou muito feliz morando onde moramos. E você, querida?"
"2e084f47";"I'm glad we found our house.";"Que bom que encontramos nossa casa."
"2e0a0a86";"Our home isn't a bad place to raise a family.";"Nossa casa não é um lugar ruim para criar uma família."
"33085761";"Ahh, yes, our house is just right.";"Ah, sim, nossa casa é perfeita."
"33085762";"We've got walls, floors... what more could we want?";"Temos paredes, pisos... o que mais poderíamos querer?"
"33085763";"We have made a rather lovely home together, haven't we dear?";"Construímos um lar muito agradável juntos, não é mesmo, querida?"
"33085765";"Our house really is quite nice, isn't it, darling?";"Nossa casa é bem bonita, não é, querida?"
"33085766";"Our place really is quite comfortable.";"Nosso lugar é bem confortável."
"33085767";"We've made a nice home for ourselves.";"Fizemos um lar aconchegante para nós."
"33097c48";"I like living in our house, don't you?";"Eu gosto de morar na nossa casa, e você?"
"35c6eae9";"I don't know how you can expect me to live in this decaying hovel we call home.";"Não sei como você espera que eu viva nesta pocilga decadente que chamamos de lar."
"35c6eaea";"I didn't realise marrying you would mean living in such squalor.";"Eu não imaginava que casar com você significaria viver em tamanha miséria."
"35c6eaeb";"Can't we move some place else?";"Não podemos nos mudar para outro lugar?"
"35c6eaec";"We have to stay in our dump of a house do we?";"Temos que ficar nessa casa caindo aos pedaços, não é?"
"35c6eaed";"Isn't it time we moved up the property ladder?";"Não está na hora de subirmos na escala imobiliária?"
"35c6eaef";"There must be a better place for us to live.";"Deve haver um lugar melhor para morarmos."
"35c7ea40";"I'm sick of our house. Can't we afford something better?";"Estou farto da nossa casa. Não podemos comprar algo melhor?"
"39856dca";"We must have one of the nicest houses in town.";"Devemos ter uma das casas mais bonitas da cidade."
"39856dcb";"I really like our house. I never get tired of it.";"Eu gosto muito da nossa casa. Nunca me canso disso."
"39856dcc";"We must have one of the nicest houses in town.";"Devemos ter uma das casas mais bonitas da cidade."
"39856dcd";"It's a great house we live in, don't you think?";"É uma ótima casa onde moramos, não acha?"
"39859470";"You can't beat our house.";"Nossa casa é imbatível."
"3e8575ea";"We have one of the nicest houses in town, don't you think?";"Temos uma das casas mais bonitas da cidade, não acha?"
"3e8575eb";"We must have one of the nicest houses in town.";"Devemos ter uma das casas mais bonitas da cidade."
"3e8575ec";"I really like our house. I never get tired of it.";"Eu gosto muito da nossa casa. Nunca me canso dela."
"3e8575ed";"We must have one of the nicest houses in town.";"Devemos ter uma das casas mais bonitas da cidade."
"3e863657";"Our house is a real peach of a place.";"Nossa casa é um verdadeiro paraíso."
"763e26a1";"I'm really getting fed up of our house!";"Estou realmente farto da nossa casa!"
"763e26a3";"I'm so sick of our stupid house.";"Estou tão cansado da nossa casa idiota."
"763e26a6";"Our house just isn't good enough.";"Nossa casa simplesmente não é boa o suficiente."
"763e26a7";"I'm really getting fed up of our house!";"Estou realmente farto da nossa casa!"
"763f2e81";"Our house is a bit of a pit, you know.";"Nossa casa é um verdadeiro buraco, sabe?"
"7d3e31a3";"That house of ours is pretty rubbish.";"Aquela nossa casa é bem ruim."
"7d3e31a4";"I'm really getting fed up with our house.";"Estou realmente farto da nossa casa."
"7d3e31a5";"I'm sick of our stupid house.";"Estou farto da nossa casa idiota."
"7d3e31a6";"I'm really getting fed up of our house!";"Estou realmente farto da nossa casa!"
"7d3e5fc0";"I'm really getting fed up of our house!";"Estou realmente farto da nossa casa!"
"8bde20b1";"I've got used to our furniture now, but don't you think we should change it?";"Eu já me acostumei com nossos móveis, mas você não acha que deveríamos trocá-los?"
"8bde20b2";"There's nothing wrong with our furniture, but they have much nicer stuff down the road...";"Nossos móveis são ótimos, mas tem coisa muito melhor lá na rua..."
"8bde20b4";"Our funiture is quite nice. Have you seen the latest models though, dear?";"Nossos móveis são muito bonitos. Já viu os modelos mais recentes, querida?"
"8bde20b5";"The decor in our house is more than adequate, but it is hardly cutting-edge.";"A decoração da nossa casa é mais do que adequada, mas está longe de ser de vanguarda."
"8bde20b6";"I am presently satisfied with our furnishings. But should we really settle? I don't know.";"Estou satisfeito com a nossa mobília. Mas será que devemos mesmo nos contentar com isso? Não sei."
"8bde20b7";"Furniture's ok, but I've seen better.";"Os móveis são bons, mas já vi melhores."
"8be28a8d";"Yeah, I guess the stuff in the house looks fine. For now.";"É, acho que as coisas da casa estão boas. Por enquanto."
"94de2e99";"I am presently satisfied with our furnishings. But, I don't know, should we really settle?";"Estou satisfeito com nossa mobília. Mas, não sei, será que deveríamos mesmo nos estabelecer?"
"94de2e9a";"The decor in our house is more than adequate, but it's hardly cutting-edge, is it?";"A decoração da nossa casa é mais do que adequada, mas não é exatamente de vanguarda, né?"
"94de2e9b";"Yeah, I guess the stuff in our house looks fine. For now.";"É, acho que as coisas da nossa casa estão boas. Por enquanto."
"94de2e9c";"Furniture's ok, but I've seen better.";"Os móveis são ok, mas já vi melhores."
"94de2e9d";"There's nothing wrong with our furniture, but they have much nicer stuff down the road...";"Não tem nada de errado com os nossos móveis, mas tem coisa muito melhor mais adiante..."
"94de2e9f";"You know, I've gotten used to our furniture now, but do you think we should change it?";"Sabe, eu já me acostumei com nossos móveis, mas você acha que deveríamos trocá-los?"
"94e05640";"Our funiture is quite nice. Have you seen the latest models though, dear?";"Nossos móveis são bem bonitos. Você já viu os modelos mais recentes, querida?"
"974738e9";"Our home is ok, but surely we could afford better.";"Nossa casa é razoável, mas certamente poderíamos morar em um lugar melhor."
"974738eb";"I thought we'd live somewhere nicer, but we'll get by.";"Eu pensei que moraríamos em um lugar melhor, mas vamos nos virar."
"974738ec";"Ours is not the nicest house in the world, but I suppose it'll do.";"Nossa casa não é a mais bonita do mundo, mas acho que serve."
"974738ef";"Our house s'alright I suppose.";"Nossa casa é razoável, eu acho."
"9d250b69";"That's it! I'm not living in a sty anymore! We've got to move!";"Chega! Não vou mais morar num chiqueiro! Precisamos nos mudar!"
"9d250b6a";"I lived under a bridge once, and it was better than our place. We have to move!";"Eu morei debaixo de uma ponte uma vez, e era melhor do que a nossa casa. Precisamos nos mudar!"
"9d250b6b";"My bile rises every time I step into our house. We simply must move!";"Sinto raiva só de pensar em entrar em casa. Precisamos nos mudar!"
"9d250b6d";"Animals live in better conditions that we do! I have had enough!";"Os animais vivem em condições melhores do que nós! Chega!"
"9d250b6e";"How can we keep living in a dump? We *have* to move!";"Como podemos continuar morando neste lugar horrível? Precisamos nos mudar!"
"9d250b6f";"Our house is a fleapit. We have to find somewhere better, now!";"Nossa casa é um verdadeiro chiqueiro. Precisamos encontrar um lugar melhor, agora!"
"9d2627f8";"Our place isn't fit for animals. We need to move!";"Nosso espaço não é adequado para animais. Precisamos nos mudar!"
"a8251c99";"If we don't move soon I don't know what I'm gonna do!";"Se não nos mexermos logo, não sei o que vou fazer!"
"a8251c9a";"Look, we either buy a new house or I'm a goner! Got it?";"Olha, ou compramos uma casa nova ou eu vou embora! Entendeu?"
"a8251c9b";"We *must* move! I cannot live in our home any longer!";"Precisamos nos mudar! Não aguento mais morar nesta casa!"
"a8251c9c";"I will not stay in this squalid wreckage a moment longer!";"Não vou ficar mais um segundo neste buraco imundo!"
"a8251c9e";"I don't know how much longer I can stay in a pit. I'm serious.";"Não sei por quanto tempo mais consigo ficar neste buraco. É sério."
"a8251c9f";"I can't stand our house. Either we move or I'm leaving!";"Não aguento mais nossa casa. Ou nos mudamos ou eu vou embora!"
"a825acb1";"If we don't move soon you're going to be living on your own.";"Se não nos mudarmos logo, você vai morar sozinho."
"becd9b22";"I never thought we'd have such a wonderful home.";"Eu nunca pensei que teríamos um lar tão maravilhoso."
"becd9b23";"Our house is perfect. Just perfect.";"Nossa casa é perfeita. Simplesmente perfeita."
"becd9b24";"I love our place. It's everything a home should be.";"Eu amo nossa casa. Ela tem tudo o que um lar deve ter."
"becd9b25";"I can't believe we're living in a mansion! It is a mansion, right?";"Não acredito que estamos morando em uma mansão! É uma mansão, não é?"
"becd9b26";"Hey! I'm a king in a castle and you are my queen!";"Ei! Eu sou o rei do castelo e você é a minha rainha!"
"becd9b27";"I always imagined residing in a wonderful home such as ours!";"Sempre imaginei morar em uma casa maravilhosa como a nossa!"
"beced054";"I cannot think of a better place to call our home. I really can't.";"Não consigo imaginar um lugar melhor para chamar de lar. De verdade, não consigo."
"c4a1285b";"If we don't move soon I'm setting fire to that house!";"Se não nos mudarmos logo, vou incendiar aquela casa!"
"c4a1285c";"Oh, don't you just hate our house? We need to move!";"Ah, você não odeia nossa casa? Precisamos nos mudar!"
"c4a1285d";"If we don't move house soon I might burn ours. I'm just so sick of it!";"Se não nos mudarmos logo, posso incendiar a nossa. Estou farta disso!"
"c4a1285e";"Oh, don't you just hate our house? We need to move!";"Ah, você não odeia nossa casa? Precisamos nos mudar!"
"c4a15d7d";"I don't think I can spend another night in that horrible house.";"Acho que não consigo passar mais uma noite naquela casa horrível."
"c9cdac52";"Oh, I always dreamed of living in a house like ours!";"Ah, eu sempre sonhei em morar em uma casa como a nossa!"
"c9cdac53";"I love our house so much!";"Eu amo muito a nossa casa!"
"c9cdac54";"I can't imagine living anywhere else!";"Não consigo me imaginar morando em outro lugar!"
"c9cdac55";"Our house is what I call a palace! Never having seen a real palace...";"Nossa casa é o que eu chamo de palácio! Nunca tendo visto um palácio de verdade..."
"c9cdac56";"I just love our home!";"Eu simplesmente amo nossa casa!"
"c9cdac57";"I am so happy in our home. Let's never move!";"Sou tão feliz em nossa casa. Que nunca nos mudemos!"
"c9d1e3cb";"Oh, our house is just perfect, dear!";"Oh, nossa casa é simplesmente perfeita, querido!"
"cda136a9";"Oh, don't you just hate our house? We need to move!";"Ah, você não odeia nossa casa? Precisamos nos mudar!"
"cda136ab";"Don't you just hate our house? We need to move!";"Você não odeia nossa casa? Precisamos nos mudar!"
"cda136ae";"Oh, don't you just hate our house? We need to move!";"Oh, você não odeia nossa casa? Precisamos nos mudar!"
"cda136af";"Look, dear, we've got to move, and we've got to move soon. Our house stinks.";"Olha, querida, precisamos nos mudar, e precisamos nos mudar logo. Nossa casa fede."
"cda39aea";"When are we gonna move out of that dump?";"Quando vamos sair desse buraco?"
"e6cc7c52";"I don't think we need to upgrade our furniture just yet, but... well, it would be nice.";"Acho que ainda não precisamos trocar nossos móveis, mas... bem, seria legal."
"e6cc7c53";"I don't think we need to upgrade our furniture just yet, but... well, it would be nice.";"Acho que ainda não precisamos trocar nossos móveis, mas... bem, seria legal."
"e6cc7c54";"It would be nice if we could improve the decoration around here.";"Seria bom se pudéssemos melhorar a decoração por aqui."
"e6cc7c55";"The decoration in our house ain't bad, you know. Could be better. But it ain't bad.";"A decoração da nossa casa não é ruim, sabe? Podia ser melhor. Mas não é ruim."
"e6cc7c56";"Nothing wrong with all the junk in our house. Not like we're kings or nothing.";"Não há nada de errado com toda a tralha na nossa casa. Não é como se fôssemos reis ou algo assim."
"e6cc7c57";"We may need to redecorate soon, dear.";"Talvez precisemos redecorar em breve, querida."
"e6cd0c95";"I don't feel the need for a major redecorating of our abode. Perhaps in the future though.";"Não sinto necessidade de uma grande reforma na nossa casa. Talvez no futuro."
"f00729e1";"We live in the best house in Albion!";"Moramos na melhor casa de Albion!"
"f00729e2";"I never dreamed I would ever live in such a palace as we do!";"Eu nunca imaginei que um dia moraria num palácio como este!"
"f00729e6";"I can't believe we live in such a dream house.";"Não acredito que moramos numa casa tão incrível."
"f00729e7";"I hope we never ever move house. Ours is just perfect.";"Espero que nunca tenhamos que nos mudar. A nossa é simplesmente perfeita."
"f0073580";"I never dreamed I would ever live in such a palace as we do!";"Eu nunca imaginei que um dia viveria num palácio como este!"
"f1cc8d82";"It would be nice if we could improbe the decoration around here.";"Seria legal se pudéssemos melhorar a decoração por aqui."
"f1cc8d83";"It would be nice if we could improve the decoration around here.";"Seria legal se pudéssemos melhorar a decoração por aqui."
"f1cc8d84";"I don't think we need to upgrade our furniture just yet, but... well, it would be nice.";"Acho que não precisamos trocar os móveis agora, mas... bem, seria legal."
"f1cc8d85";"Our house is decorated okay.";"Nossa casa está bem decorada."
"f1cc8d86";"Nothing wrong with all the junk in our house. Not like we're kings or nothing.";"Não tem nada de errado com as coisas que temos em casa. Não somos reis nem nada."
"f1cc8d87";"I don't feel the need for a major redecorating of our abode. Perhaps in the future though.";"Não sinto necessidade de uma grande reforma na nossa casa. Talvez no futuro."
"f1cd162e";"I don't feel the need for a major redecorating of our abode. Perhaps in the future though.";"Não sinto necessidade de uma grande reforma na nossa casa. Talvez no futuro."
"f90737cb";"I still can't believe we live in such an amazing house.";"Ainda não consigo acreditar que moramos em uma casa tão incrível."
"f90737cc";"I couldn't love our house more if it was made of chocolate.";"Eu não poderia amar mais nossa casa, mesmo que ela fosse feita de chocolate."
"f90737cd";"I never dreamed I would ever live in such a palace as we do!";"Eu nunca sonhei que um dia moraria em um palácio como este!"
"f90737cf";"We live in the best house in Albion!";"Moramos na melhor casa de Albion!"
"f90744a7";"I never dreamed I would ever live in such a palace as we do!";"Nunca imaginei que um dia moraria num palácio como este!"
