Hash;Original;Tradução
"077c9d4";"I, um, have something for you. Just don't hurt me, evil one.";"Eu, hum, tenho algo para você. Só não me machuque, criatura maligna."
"7a44f1b";"Thank YOU!";"Obrigada!"
"7a44f1c";"Thank YOU!";"Obrigada!"
"7a44f1d";"Thank YOU!";"Obrigada!"
"7a44f1f";"Thank YOU!";"Obrigada!"
"7ad7c14";"Thank YOU!";"Obrigada!"
"e9ec83f";"Thank you.";"Obrigado."
"e9ede91";"Why, thank you kindly.";"Muito obrigado."
"1741bd97";"The more renowned you are, the more people you can get to follow you at a time.";"Quanto mais renomado você for, mais pessoas poderão segui-lo ao mesmo tempo."
"312b9632";"Why thanks!";"Muito obrigado!"
"312b9633";"Why thanks!";"Muito obrigado!"
"312b9634";"Why thanks!";"Muito obrigado!"
"312b9635";"Thank you!";"Obrigado!"
"312caace";"Why thanks!";"Muito obrigado!"
"38d93cb2";"Like a gift, funny adventurer?";"Gostaria de um presente, aventureiro engraçado?"
"3c2ba762";"Why thanks!";"Muito obrigado!"
"3c2ba763";"Thank you, friend.";"Obrigado, amigo."
"3c2ba764";"Why thanks!";"Muito obrigado!"
"3c2ba765";"Nice one.";"Muito bom."
"3c319a15";"Why thanks!";"Muito obrigado!"
"3d62c1d1";"Whee! Have you tasted these mothers? What a kick.";"Uau! Já provou essas belezinhas? Que delícia."
"3d62c1d3";"You're not supposed to interrupt sleepwalkers. Or drinkers.";"Não se deve interromper sonâmbulos. Ou bêbados."
"3d62c1d6";"Oh, the Nameless Alcoholics meeting's been cancelled.";"Ah, a reunião dos Alcoólicos Anônimos foi cancelada."
"3d62c1d7";"Can't talk! Drinking!";"Não posso falar! Estou bebendo!"
"3d63621c";"I'm gonna get smashed tonight. Heck yeah!";"Vou ficar bêbado hoje à noite. Com certeza!"
"3d68080a";"Ooh, a beer would be nice.";"Hum, uma cerveja cairia bem."
"3d68080b";"What ales do you have?";"Quais cervejas você tem?"
"3d68080c";"A lovely cold beer, please.";"Uma cerveja bem gelada, por favor."
"3d68080d";"One of those. No, make it two.";"Uma dessas. Não, duas."
"3d69f81e";"You got any of that strong stuff?";"Tem alguma dessas bebidas fortes?"
"4268102a";"Tall, frosty one, please.";"Alto e gelado, por favor."
"4268102b";"Make it a large one.";"Que seja grande."
"4268102c";"Chuck us over a beer, will you.";"Nos dê uma cerveja, por favor."
"4268102d";"Hmm, let's try some of that Bowerstone stout.";"Hum, vamos experimentar um pouco daquela stout da Bowerstone."
"426be98e";"Pint of your strongest.";"Um copo da sua mais forte."
"4462ccd3";"Nice to see you enjoy a drink like the rest of us.";"Que bom ver você curtindo uma bebida como nós."
"4462ccd4";"Good stuff huh?";"Muito bom, né?"
"4462ccd5";"Less talking, more drinking.";"Menos conversa, mais bebida."
"4462ccd6";"Don't you just love the atmosphere in here?";"Você não adora o ambiente aqui?"
"44650428";"Oh, you buying me a drink?";"Ah, você vai me pagar uma bebida?"
"46e9b581";"I'm going to get well and truly hammered today.";"Vou ficar completamente bêbado hoje."
"46e9b584";"You tried some Bloodstone ale yet?";"Já provou a cerveja de Bloodstone?"
"46e9b586";"You should try the specials. They make you feel just like them.";"Você deveria experimentar os especiais. Eles fazem você se sentir como eles."
"46e9b587";"So what are you going to order?";"Então, o que você vai pedir?"
"46ea055f";"Fancy getting smashed?";"Que tal se embebedar?"
"47f15d62";"Your first time in this place? My memory always seems to go while I'm here.";"É a sua primeira vez aqui? Minha memória sempre falha quando estou aqui."
"47f15d63";"They say they sell alcohol in here. Can you believe it? Ha ha!";"Dizem que vendem álcool aqui. Acredita? Haha!"
"47f15d64";"I never miss a pub quiz here. Though they haven't had one for fifteen years.";"Nunca perco um quiz de bar aqui. Embora não haja um há quinze anos."
"47f15d65";"I always come here to do my drinking.";"Sempre venho aqui para beber."
"47f15d66";"How drunk are you?";"Quão bêbado você está?"
"47f15d67";"It's not my first time in a drinking establishment you know.";"Não é a minha primeira vez em um bar, sabia?"
"47f42b38";"I don't come here very often.";"Eu não venho aqui com muita frequência."
"4be9bda1";"There's no way I'm walking out of this place tonight.";"Não há como eu sair daqui hoje à noite."
"4be9bda5";"If you hold your breath for three minutes you can pass out quicker.";"Se você prender a respiração por três minutos, pode desmaiar mais rápido."
"4be9bda6";"Here for a nice quiet drink?";"Veio para tomar um drinque tranquilo?"
"4be9bda7";"It's not the size of your drink my friend. It's what you do with it.";"Não é o tamanho da sua bebida, meu amigo. É o que você faz com isso."
"4bea92f2";"Do you ever wonder what they put in these drinks?";"Você já se perguntou o que eles colocam nessas bebidas?"
"52f16e92";"I do enjoy a drink now and again. And again. And again.";"Eu gosto de beber de vez em quando. E de novo. E de novo."
"52f16e93";"I won't lie to you. I come here to get drunk.";"Não vou mentir. Venho aqui para beber."
"52f16e94";"Isn't this the best pub in the world? What pub is it again?";"Este não é o melhor pub do mundo? Qual é o nome mesmo?"
"52f16e95";"I grew up in this place you know.";"Eu cresci neste lugar, sabia?"
"52f16e96";"I come here all the time. But I'm usually too waste to recognise anyone.";"Venho aqui o tempo todo. Mas geralmente estou tão bêbado que não reconheço ninguém."
"52f16e97";"I do enjoy a tipple now and again. Don't you?";"Eu gosto de tomar um drinque de vez em quando. E você?"
"52f3f5d6";"I am rather enjoying my stay in this establishment.";"Estou gostando bastante da minha estadia neste estabelecimento."
"5e0d3bb7";"You sell any of them Old Kingdom liqueurs?";"Vocês vendem algum desses licores do Velho Reino?"
"5e0d6531";"Cheers!";"Saúde!"
"5e0d6533";"Cheers!";"Saúde!"
"5e0d6534";"Cheers!";"Saúde!"
"5e0d6535";"Oh, thank you so much.";"Oh, muito obrigada."
"5e0d6536";"Thank you.";"Obrigado."
"5e0d6537";"Cheers!";"Saúde!"
"5e143ab7";"Cheers!";"Saúde!"
"64f68818";"You look so cool I think you should have a present.";"Você está tão estiloso(a) que acho que merece um presente."
"650d7031";"Cheers!";"Saúde!"
"650d7032";"Thankee!";"Obrigado!"
"650d7033";"Cheers!";"Saúde!"
"650d7034";"Cheers!";"Saúde!"
"650d7035";"Cheers!";"Saúde!"
"650d7036";"Cheers!";"Saúde!"
"6510abe0";"Cheers!";"Saúde!"
"68e7944b";"Don't hurt me or nothing, but I've got something for you.";"Não me machuque nem nada, mas tenho algo para você."
"68e7944c";"Don't want to bother ya, but I have something you might like.";"Não quero te incomodar, mas tenho algo que você pode gostar."
"68e7944d";"There's something I'd, um, like you to have. If you want.";"Tem algo que eu gostaria que você tivesse. Se você quiser."
"68e7944e";"I have something for... for you!";"Tenho algo para... para você!"
"68e97891";"Oh, I have something... something for you.";"Ah, eu tenho algo... algo para você."
"6ff9361f";"I'll give you a present if I can copy your style.";"Eu te dou um presente se eu conseguir copiar seu estilo."
"71e7a299";"Oh, hum, sorry to bother you, but I have something!";"Ah, desculpe incomodar, mas tenho algo!"
"71e7a29b";"Oh, hum, sorry to bother you, but I have something!";"Ah, desculpe incomodar, mas tenho algo!"
"71e7a29e";"Oh, don't want to disturb you but I have something you might like.";"Ah, não quero incomodar, mas tenho algo que você pode gostar."
"71e7a29f";"Oh, sorry to bother you, but I've got something you can have!";"Ah, desculpe incomodar, mas tenho algo que você pode pegar!"
"71eac33b";"Pl-please take this.";"Por favor, pegue isto."
"7bb3ede1";"Thanks.";"​​Obrigado."
"7bb3ede4";"Ta.";"Valeu."
"7bb3ede6";"Thank you.";"Obrigado."
"7bb3ede7";"Cheers.";"Valeu."
"7bb6cf06";"Thanks so much.";"Muito obrigado."
"80b3f581";"Cheers.";"Obrigado."
"80b3f585";"I thank ye.";"Agradeço."
"80b3f586";"Cheers.";"Obrigado."
"80b3f587";"Much obliged!";"Muito obrigado!"
"80b9587c";"Ta!";"Valeu!"
"9642dcd3";"<whimpers> Here have a present. But don't hurt me.";"<whimpers> Aqui, tome um presente. Mas não me machuque."
"9725e1b1";"Hey! I have no respect for you, but I do have something else!";"Ei! Não tenho respeito por você, mas tenho algo mais!"
"9725e1b3";"Hey you! You might be a loser, but I have just the thing for you.";"Ei, você! Você pode ser um perdedor, mas tenho algo perfeito para você."
"9725e1b4";"Hey loser! I have something for you!";"Ei, perdedor! Tenho algo para você!"
"9725e1b5";"Excuse me! I may have no respect for you, but I do have an item...";"Com licença! Posso não ter respeito por você, mas tenho um item..."
"9725e1b6";"Pardon! Would you like a disgraceful gift?";"Perdão! Você gostaria de um presente vergonhoso?"
"9725e1b7";"Oi loser! I have something for you!";"Ei, perdedor! Tenho uma coisa para você!"
"9728b665";"Oi you! I have just the thing for a loser like you!";"Ei, você! Tenho exatamente o que você precisa, perdedor!"
"9a08b005";"I don't come here very often.";"Eu não venho aqui com muita frequência."
"9a0bc168";"How can anyone stand the smell in these establishments?";"Como alguém consegue suportar o cheiro nesses estabelecimentos?"
"9d39c3bd";"Oh, don't hurt me! I'll give you a gift if you leave me alone.";"Oh, não me machuque! Eu te dou um presente se você me deixar em paz."
"9e25ecb1";"Because I do not respect, I must hand over this.";"Como não respeito, devo entregar isto."
"9e25ecb2";"Excuse me! I may have no respect for you, but I do have an item...";"Com licença! Posso não ter respeito por você, mas tenho um item para você..."
"9e25ecb3";"You're just a loser. Have this.";"Você é só um perdedor. Toma isso."
"9e25ecb4";"Oi, loser! I've got something for you!";"Ei, perdedor! Tenho algo para você!"
"9e25ecb5";"Hey, loser. Have this present. Yeah, you're so pathetic you have to take my charity.";"Ei, perdedor. Toma este presente. É, você é tão patético que precisa da minha caridade."
"9e25ecb6";"Hey! I have no respect for you, but I do have something else!";"Ei! Não tenho respeito por você, mas tenho algo mais!"
"9e27d40e";"Hey loser! I have something for you!";"Ei, perdedor! Tenho algo para você!"
"a2d02362";"Hey! I have something for you!";"Ei! Tenho algo para você!"
"a2d02363";"Hey! I've got something you might want!";"Ei! Tenho algo que você pode querer!"
"a2d02364";"Talk to me! I have something you could use!";"Fale comigo! Tenho algo que você pode usar!"
"a2d02365";"Oi! I have something for you!";"Ei! Tenho algo para você!"
"a2d02366";"Got something for ya!";"Tenho algo para você!"
"a2d02367";"Excuse! I have an item you might find useful!";"Com licença! Tenho um item que você pode achar útil!"
"a2d0ed76";"Excuse me! I have something for you!";"Com licença! Tenho algo para você!"
"add03492";"Hey! I have something for you!";"Ei! Tenho algo para você!"
"add03493";"Talk to me! I have something you could use!";"Fale comigo! Tenho algo que você pode usar!"
"add03494";"Hey! I've got something you might want!";"Ei! Tenho algo que você pode querer!"
"add03495";"Oi! I've got something you might want!";"Ei! Tenho algo que você pode querer!"
"add03496";"Oi! I have something for you!";"Ei! Tenho algo para você!"
"add03497";"Pardon me, but I have something for you!";"Com licença, mas tenho algo para você!"
"add0bb10";"Excuse me! I have an item you might find useful!";"Com licença! Tenho um item que você pode achar útil!"
"aee78351";"Why thanks!";"Muito obrigado!"
"aee78354";"Why thanks!";"Muito obrigado!"
"aee78356";"Why thanks!";"Muito obrigado!"
"aee78357";"Why thanks!";"Muito obrigado!"
"aeebe8ed";"Why thanks!";"Muito obrigado!"
"b272d81a";"You have reached the maximum number of followers.";"Você atingiu o número máximo de seguidores."
"b3e78b71";"Why thanks!";"Muito obrigado!"
"b3e78b75";"Cheers, mate.";"Valeu, camarada."
"b3e78b76";"Why thanks!";"Muito obrigado!"
"b3e78b77";"Why thanks!";"Muito obrigado!"
"b3e9b987";"Why thanks!";"Muito obrigado!"
"b5522b21";"I have something for you, oh dark one.";"Tenho algo para você, ó criatura das trevas."
"b5522b22";"Hey! I have just the thing for a monster like you.";"Ei! Tenho exatamente o que você precisa, monstro."
"b5522b24";"I have a gift for you, oh evil one!";"Tenho um presente para você, ó criatura maligna!"
"b5522b25";"You are evil well and truly. And deserving of this gift.";"Você é verdadeiramente maligno. E merece este presente."
"b5522b26";"Your black heart deserves a dark gift. Here...";"Seu coração negro merece um presente sombrio. Aqui..."
"b5522b27";"I have something that only a truly evil person deserves. Here.";"Eu tenho algo que só uma pessoa verdadeiramente má merece. Aqui."
"b552cd31";"You're a mean one alright. And I've got just what you need.";"Você é mesmo uma pessoa má. E eu tenho exatamente o que você precisa."
"be523909";"Hello? Er... Your terrible deeds have earnt you a reward.";"Olá? Er... Seus atos terríveis lhe renderam uma recompensa."
"be52390a";"Your black heart deserves a dark gift. Here...";"Seu coração negro merece um presente sombrio. Aqui..."
"be52390b";"You're a mean one alright. And I have just what you need.";"Você é mesmo malvado. E eu tenho exatamente o que você precisa."
"be52390c";"Oi, evil one! I have something for you...";"Ei, malvado! Tenho algo para você..."
"be52390d";"Hey, you! You seem like a nasty one... I have something you could use.";"Ei, você! Parece ser uma pessoa desagradável... Tenho algo que você pode usar."
"be52390f";"I have a gift for you, oh evil one!";"Tenho um presente para você, ó criatura maligna!"
"be525770";"Your black heart deserves a dark gift. Here...";"Seu coração negro merece um presente sombrio. Aqui está..."
"c8c8748b";"Got any Crucible Beer?";"Tem alguma cerveja Crucible?"
"c8c8748c";"Nothing but Bloodstone Ale for me.";"Só Bloodstone Ale para mim."
"c8c8748d";"Some Bloodstone ale would go down nicely.";"Uma cerveja de Bloodstone cairia muito bem agora."
"c8c8748e";"A pint of Bowerstone Brown please.";"Uma caneca de Bowerstone Brown, por favor."
"c8c95f69";"A frothy pint of hobbe's water please.";"Uma caneca bem cremosa de Hobbe's Water, por favor."
"d1705201";"Thanks!";"Obrigado!"
"d1705203";"Thanks!";"Obrigado!"
"d1705206";"Thanks!";"Obrigada!"
"d1705207";"Thanks!";"Obrigada!"
"d171f647";"Thanks!";"Obrigada!"
"d1c882d9";"A shot of Oakfield rum please.";"Uma dose de rum Oakfield, por favor."
"d1c882db";"Do you have that drink that makes your tongue go purple?";"Você tem aquela bebida que deixa sua língua roxa?"
"d1c882de";"A nice pint of Bloodstone's finest.";"Uma boa caneca da melhor Bloodstone."
"d1c882df";"Some Bloodstone ale, quick.";"Uma Bloodstone Ale, rapidinho."
"d1c8fc30";"A want something simple... How about a pint of Bowerstone stout?";"Quero algo simples... Que tal uma caneca de Bowerstone Stout?"
"d575f351";"Oh! I have.... I have something for you...";"Oh! Eu tenho... Eu tenho algo para você..."
"d575f352";"Hum, er... here. I have a gift for you...";"Hum, er... aqui. Eu tenho um presente para você..."
"d575f353";"Hum, er... here. I have a gift for you...";"Hum, er... aqui. Eu tenho um presente para você..."
"d575f354";"Don't hurt me! I have something to give you...";"Não me machuque! Eu tenho algo para te dar..."
"d575f355";"Please don't hurt me! I've got something for you.";"Por favor, não me machuque! Eu tenho algo para você."
"d575f357";"Don't hurt me! I have something to give you...";"Não me machuque! Tenho algo para te dar..."
"d57620b2";"Er... have this! It's all yours!";"Er... tome isto! É todo seu!"
"d8705d03";"Thanks!";"Obrigado!"
"d8705d04";"Thanks!";"Obrigado!"
"d8705d05";"Thanks!";"Obrigado!"
"d8705d06";"Thanks!";"Obrigado!"
"d8712a30";"Thanks!";"Obrigado!"
"da2187f9";"You're so funny you deserve a present!";"Você é tão engraçado que merece um presente!"
"dc75fe59";"I ha-have something to give you...";"Eu tenho algo para te dar..."
"dc75fe5a";"Hum, er... here. I have a gift for you...";"Hum, er... aqui. Eu tenho um presente para você..."
"dc75fe5c";"Please don't hurt me! I've got something for you.";"Por favor, não me machuque! Tenho algo para você."
"dc75fe5d";"You... you... should have this.";"Você... você... deveria ficar com isso."
"dc75fe5e";"Hum, er... here. I have a gift for you...";"Hum, er... aqui. Tenho um presente para você..."
"dc75fe5f";"Er... have this! It's all yours!";"Er... fique com isso! É todo seu!"
"dc76fc50";"Please don't hurt me! I've got something for you.";"Por favor, não me machuque! Tenho algo para você."
"dd75eac1";"I like what I see! And I have something you might like too...";"Gostei do que vi! E tenho algo que você também pode gostar..."
"dd75eac3";"Hot stuff! Here, I have a gift for you....";"Que gata! Aqui, tenho um presente para você..."
"dd75eac4";"Well, looky at you! Want a present?";"Olha só você! Quer um presente?"
"dd75eac5";"How very attractive! Have this gift...";"Que atraente! Tome este presente..."
"dd75eac6";"You are so fabulous-looking that I must give you this.";"Você é tão fabulosa que preciso te dar isso."
"dd75eac7";"Nice! Why don't you have this gift beautiful?";"Que legal! Por que você não aceita este presente, linda?"
"dd79b9aa";"I have just the thing for a good-looking thing like you.";"Tenho a coisa perfeita para uma gracinha como você."
"df22f259";"You're so funny! Have this.";"Você é tão engraçado! Aqui está."
"df398e87";"Anyone know who that stranger is?";"Alguém sabe quem é aquele estranho?"
"df3c6d0d";"An outsider? How did they get here?";"Um forasteiro? Como ele chegou aqui?"
"e43996a7";"Who's that? Never seen them before!";"Quem é? Nunca vi essa pessoa antes!"
"e439db93";"Look! A visitor! Hasn't been one of those in while.";"Olha! Um visitante! Faz tempo que não aparece um."
"e475f5c1";"How very attractive! Have this gift...";"Que atraente! Receba este presente..."
"e475f5c2";"You deserve a reward for making the world a more beautiful place.";"Você merece uma recompensa por tornar o mundo um lugar mais bonito."
"e475f5c3";"You're so good looking, I think you should have this.";"Você é tão bonito(a), acho que deveria ficar com isso."
"e475f5c4";"Well, lookey at you! Want a present?";"Olha só você! Quer um presente?"
"e475f5c5";"Hey good-lookin'! Want a present?";"Ei, bonitão(a)! Quer um presente?"
"e475f5c6";"Hot stuff! Here, I have a gift for you....";"Que gato(a)! Aqui, tenho um presente para você..."
"e478f802";"Nice! Why don't you have this gift, gorgeous?";"Que legal! Por que você não aceita este presente, lindo(a)?"
"e8ea17d8";"Hey! Over here!";"Ei! Aqui!"
"efea701b";"Hey! Over here!";"Ei! Aqui!"
"f3e21221";"Hey! Over here!";"Ei! Aqui!"
"f3e21222";"Hey! Over here!";"Ei! Aqui!"
"f3e21226";"Hey! Over here!";"Ei! Aqui!"
"f3e21227";"Hey! Over here!";"Ei! Aqui!"
"f3e22fc0";"Hey! Over here!";"Ei! Aqui!"
"f77aaccf";"Uh... um... sorry to bother you, but I have something for you!";"Uh... hum... desculpe incomodar, mas tenho algo para você!"
"fce2200b";"Hey! Over here!";"Ei! Aqui!"
"fce2200c";"Hey! Over here!";"Ei! Aqui!"
"fce2200d";"Hey! Over here!";"Ei! Aqui!"
"fce2200f";"Hey! Over here!";"Ei! Aqui!"
"fce4ac82";"Hey! Over here!";"Ei! Aqui!"
"fea44131";"Thank YOU!";"Muito obrigado!"
"fea44132";"Thank YOU!";"Muito obrigado!"
"fea44136";"Thank YOU!";"Muito obrigado!"
"fea44137";"Thank YOU!";"Muito obrigado!"
"fea527c9";"Thank YOU!";"Muito obrigado!"
