Hash;Original;Tradução
"736dc56";"So you'll come to the island save us from the cold weather?";"Então você virá à ilha para nos salvar do frio?"
"1524de18";"And here comes my trusted assistant. He carried out my instructions rather well, and deserves a big hand.";"E aqui está meu fiel assistente. Ele cumpriu minhas instruções muito bem e merece muitos aplausos."
"1527d5e2";"And here comes my trusted assistant. She carried out my instructions rather well, and deserves a big hand.";"E aqui está meu fiel assistente. Ela executou minhas instruções muito bem e merece muitos aplausos."
"18765015";"Will you come then?";"Você virá então?"
"1895b539";"Talk to the rather odd man on the Bowerstone docks.";"Fale com o homem um tanto estranho nos cais de Bowerstone."
"202f3370";"We took this from an assassin who we think was sent to eliminate the Chieftain. Unfortunately, he tripped over a pebble and impaled himself on a silver toothpick before he could do the job.";"Pegamos isso de um assassino que acreditamos ter sido enviado para eliminar o Chefe. Infelizmente, ele tropeçou em uma pedrinha e se empalou em um palito de prata antes de conseguir concluir a missão."
"20515418";"Knothole Island is suffering from a terrible drought.";"A Ilha Knothole está sofrendo com uma terrível seca."
"27500468";"I believe that's the outfit worn by members of the Black Wheel Gang. They were a roaming group of necromantic warriors who sang a cappella lullabies during battle.";"Acredito que essa seja a roupa usada pelos membros da Gangue da Roda Negra. Eles eram um grupo nômade de guerreiros necromânticos que cantavam canções de ninar a cappella durante as batalhas."
"2d4aca28";"One of the warriors from the barbarian army who invaded the island a couple of years ago left that weapon as an apology for trampling a flower bed.";"Um dos guerreiros do exército bárbaro que invadiu a ilha há alguns anos deixou essa arma como um pedido de desculpas por ter pisoteado um canteiro de flores."
"2f39e7c3";"I was hoping you would turn up again. I was starting to think I might have to go out looking for you.";"Eu esperava que você aparecesse de novo. Comecei a achar que teria que sair para te procurar."
"310c1555";"The people of Knothole Island are freezing to death.";"Os habitantes da Ilha Knothole estão morrendo congelados."
"323c85d0";"The island is in trouble again, but I'm sure you will save us. Ready for another trip?";"A ilha está em apuros novamente, mas tenho certeza de que você nos salvará. Pronto para mais uma viagem?"
"350174c4";"Return to the Chieftain.";"Retorne ao Chefe."
"350174c5";"Dig up the Storm Key";"Desenterre a Chave da Tempestade"
"350174c7";"Enter the shrine and activate the totem.";"Entre no santuário e ative o totem."
"3503f261";"Talk to the Chieftain.";"Fale com o Chefe."
"360ad946";"So you will retrieve the Storm Totem from the Summer Shrine?";"Então você vai recuperar o Totem da Tempestade do Santuário do Verão?"
"3e00cf86";"Put an end to the Knothole rains?";"Acabar com as chuvas de Knothole?"
"488f0170";"What? I'm not finished with you!";"O quê? Eu ainda não terminei com você!"
"4d026bcd";"We've been eating nothing but dry dirt for a week. There is not a speck of truth in those rumours about me having a stockpile of fruit and sweetmeats for my personal use.";"Faz uma semana que só comemos terra seca. Não há um pingo de verdade naqueles boatos de que eu tenho um estoque de frutas e doces para meu consumo pessoal."
"4e04192d";"Bring us some rain, will you? It's the least you can do.";"Traga-nos um pouco de chuva, por favor? É o mínimo que você pode fazer."
"4e84d1a5";"So, the bringer of drizzle, flooding and chaos returns.";"Então, o portador da garoa, das inundações e do caos retorna."
"4f83f5d7";"Your meddling must have angered the gods, because they haven't stopped spitting at us since you left.";"Sua intromissão deve ter irritado os deuses, porque eles não param de nos xingar desde que você foi embora."
"5002421e";"People think it's easy being Chieftain. But I have to make all the big decisions. Do they ever think about that?";"As pessoas acham que ser chefe é fácil. Mas eu tenho que tomar todas as grandes decisões. Será que elas pensam nisso?"
"50819796";"I hold you personally responsible, and there is only one way we can resolve this unfortunate situation.";"Eu o responsabilizo pessoalmente, e só há uma maneira de resolvermos essa situação infeliz."
"5180fa47";"You must find the final totem and restore the power over the weather to me. I mean, to us.";"Você precisa encontrar o totem final e restaurar o poder sobre o clima para mim. Quer dizer, para nós."
"5280fc3a";"Enter the Storm Shrine and bring me - us - the Ice Totem. And you will be compensated and so on and so forth.";"Entre no Santuário da Tempestade e traga-me - a nós - o Totem de Gelo. E você será recompensado e assim por diante."
"54231da6";"Go with Gordon and help out the people of Knothole Island?";"Acompanhar Gordon e ajudar o povo da Ilha Knothole?"
"5603a240";"Join Jessica or the Chieftain.";"Junte-se a Jessica ou ao Chefe."
"56c29b38";"Now, to avoid any future problems, only I and my assistant will have access to the Weather Chamber.";"Agora, para evitar problemas futuros, somente eu e meu assistente teremos acesso à Câmara Meteorológica."
"58b4f861";"Are you really going to help this tyrant exploit us like that? Join the people, share the power with us. We will flourish and you'll be in our hearts forever.";"Você realmente vai ajudar esse tirano a nos explorar assim? Junte-se ao povo, compartilhe o poder conosco. Nós prosperaremos e você estará para sempre em nossos corações."
"58c09518";"Gather round! Gather round! Thanks to me, your beloved leader, the Weather Chamber shall soon open again.";"Reúnam-se! Reúnam-se! Graças a mim, seu amado líder, a Câmara do Tempo logo se abrirá novamente."
"5ab4fff4";"Have you forgotten who I am? All that I've done for you? This Hero stands firmly by my side, and that is all there is to it.";"Você se esqueceu de quem eu sou? De tudo que fiz por você? Este Herói permanece firme ao meu lado, e isso é tudo."
"5ac15e1b";"Drop dead!";"Morra!"
"5bb50167";"Don't do anything stupid now. Work with me and there's 10,000 gold pieces in it for you.";"Não faça nada estúpido agora. Trabalhe comigo e haverá 10.000 peças de ouro para você."
"5bc2a2d9";"Yeah... Boo!";"É... Bu!"
"5c5728b6";"I put that outfit together after a marauding army of barbarians invaded the island some years back. Nice folk actually. They mostly just wanted to have a quiet chat over a cup of tea.";"Montei essa roupa depois que um exército de bárbaros saqueadores invadiu a ilha alguns anos atrás. Gente legal, na verdade. Eles só queriam bater um papo tranquilo tomando uma xícara de chá."
"5cb415d0";"Yeah, that's what we want!";"É isso que a gente quer!"
"5cc09053";"What? A fee? This was all your fault to begin with!";"O quê? Uma taxa? A culpa foi toda sua desde o início!"
"5db5044d";"Weather to the people!";"Tempo para o povo!"
"5dc2c157";"All I will require is a small monthly fee from each of you, as I undertake this strenuous guardianship.";"Tudo o que preciso é de uma pequena taxa mensal de cada um de vocês, enquanto assumo essa árdua responsabilidade de tutela."
"60c10e1c";"The only reasonable demand is for you to hand control of the weather to us. To the people. And I'm sure this brave adventurer agrees.";"A única exigência razoável é que vocês nos entreguem o controle do clima. Ao povo. E tenho certeza de que este bravo aventureiro concorda."
"61c10f8f";"Now, now, there's no need for a violent upheaval. I am your Chieftain and this is a very reasonable demand.";"Calma, calma, não há necessidade de uma revolta violenta. Eu sou o seu Chefe e esta é uma exigência muito razoável."
"62944d0f";"Your faithful dog may be gone, but you can still dig up items using your spade.";"Seu fiel cão pode ter ido embora, mas você ainda pode desenterrar itens usando sua pá."
"6775ab52";"Down by the Docks";"Perto das Docas"
"6abe798f";"Let's go! And let me know if you spot any new leaks...";"Vamos lá! E me avise se você encontrar algum vazamento novo..."
"6c10cf27";"Are you just going to stand there while we all drown?";"Vai ficar aí parado enquanto todos nós nos afogamos?"
"6c875405";"Oh, you're back, are you? I'm not a man to be kept waiting.";"Ah, você voltou, é? Não sou homem de ficar esperando."
"6d11ba14";"We came to this island many centuries ago to find peace and perfect weather. And I will make it a paradise once again.";"Viemos para esta ilha há muitos séculos em busca de paz e clima perfeito. E eu farei dele um paraíso mais uma vez."
"6e121b48";"It's always the same. Whenever any little thing goes wrong, it's always my fault. Rain, sunshine, appropriation of town funds...";"É sempre a mesma coisa. Sempre que algo dá errado, a culpa é sempre minha. Chuva, sol, desvio de verbas municipais..."
"70cf28b4";"Use the Ice Totem?";"Usar o Totem de Gelo?"
"787ed4c7";"Just where do you think you're going?";"Aonde você pensa que vai?"
"7c205392";"Knothole Island's Big Freeze";"Grande Congelamento da Ilha Knothole"
"7c99d124";"You have no idea how cold it is on the island. I can't take another day of winter!";"Você não faz ideia de como é frio na ilha. Não aguento mais um dia de inverno!"
"7d995541";"My people will die without your help!";"Meu povo morrerá sem a sua ajuda!"
"7e99d40a";"If you're worried about my submarine, I can tell you it's almost perfectly safe. I invented it myself. Isn't that reassuring?";"Se você está preocupado com meu submarino, posso lhe garantir que ele é quase perfeitamente seguro. Eu mesmo o inventei. Não é reconfortante?"
"8e25dd26";"That weapon belonged to an awful woman. She killed half the village on her way to test her skills at the three Weather Shrines. I'm glad to say she didn't make it out of the last one.";"Essa arma pertencia a uma mulher horrível. Ela matou metade da vila a caminho de testar suas habilidades nos três Santuários do Clima. Ainda bem que ela não sobreviveu ao último."
"8eff07c9";"A dark figure wearing this outfit appeared one day in the centre of town and started to curse everyone in a strange tongue. A hunter threw a harpoon in his neck before he could finish, so it was okay.";"Uma figura sombria vestindo esta roupa apareceu um dia no centro da cidade e começou a amaldiçoar todos em uma língua estranha. Um caçador lançou um arpão em seu pescoço antes que ele pudesse terminar, então tudo bem."
"8ffc68ae";"Don't do anything stupid now. Work with me and there's a big bag of gold in it for you.";"Não faça nenhuma besteira agora. Trabalhe comigo e você receberá um saco cheio de ouro."
"937bc2f2";"I can't remember the last time my feet were dry. And people think they have problems!";"Não me lembro da última vez que meus pés estiveram secos. E as pessoas acham que têm problemas!"
"938b76ea";"Use the Storm Totem?";"Usar o Totem da Tempestade?"
"947cc15a";"All the useless inventions on this island and not a single portable rain-shielding device.";"Todas as invenções inúteis desta ilha e nenhum dispositivo portátil para proteção contra a chuva."
"967bc5b0";"They're just never happy. "Chieftain, make it hot!", "Chieftain, make it rain!", "Chieftain, make the rain go away!". I'm just a poor unelected official!";"Eles nunca estão felizes. Chefe, faça chover! Chefe, faça chover! Chefe, faça a chuva parar! Sou apenas um pobre funcionário não eleito!"
"981b7c10";"Knothole Island Drowning";"Afogamento na Ilha Knothole"
"9ce00a79";"It is hardly my fault. I don't know why everyone insists on blaming me!";"Não é minha culpa. Não sei por que todos insistem em me culpar!"
"9cee65fc";"Oh, I knew you'd come back!";"Ah, eu sabia que você voltaria!"
"9eded77e";"Ah, you! Yes, it's about time you came back. Look at the mess you've left us in. You've turned our beautiful island into a desert!";"Ah, você! Sim, já era hora de voltar. Olha a bagunça que você deixou. Transformou nossa linda ilha em um deserto!"
"9ee1aca0";"At least it isn't raining. There's no pleasing some.";"Pelo menos não está chovendo. É impossível agradar a todos."
"9fe0ef50";"I must launch a pre-emptive strike into the hearts and minds of the people...";"Devo lançar um ataque preventivo aos corações e mentes das pessoas..."
"a0da8d73";"You can start by retrieving the Storm Totem from the Summer Shrine. Before we die of thirst or lack of personal hygiene.";"Você pode começar recuperando o Totem da Tempestade no Santuário de Verão. Antes que morramos de sede ou falta de higiene pessoal."
"a1d9e0e5";"And it is entirely your doing. I am a victim here. And I demand, we all demand, that you make amends.";"E a culpa é inteiramente sua. Eu sou a vítima aqui. E eu exijo, todos nós exigimos, que você se redima."
"a6c50930";"Join Jessica and earn the love of the people of Knothole Island.";"Junte-se a Jessica e conquiste o amor do povo da Ilha Knothole."
"b503c347";"Good, good. The Summer Key is buried... over there... somewhere... Well, you don't expect me to find it for you, do you?";"Bom, bom. A Chave do Verão está enterrada... ali... em algum lugar... Bem, você não espera que eu a encontre para você, espera?"
"b59cb3b4";"Quiet, stupid!";"Silêncio, idiota!"
"b731a8c0";"Bring back the rain to Knothole Island?";"Trazer a chuva de volta para a Ilha Knothole?"
"b7a11bd2";"Hush!";"Shhh!"
"b89f6ed0";"What are we still waiting for?";"O que estamos esperando?"
"b9a069bb";"It's about time you came back.";"Já era hora de você voltar."
"bee31d2f";"Assuming the rains haven't washed it away, the Storm Key should be buried somewhere over there.";"Supondo que as chuvas não a tenham levado, a Chave da Tempestade deve estar enterrada em algum lugar por ali."
"bf620869";"You've freed us. You have no idea how much this means to everyone on the island. We can never thank you enough.";"Você nos libertou. Você não tem ideia do quanto isso significa para todos na ilha. Nunca poderemos te agradecer o suficiente."
"bfe475dc";"Do this great deed, and you, um... shall be remembered always as our greatest Hero. Absolutely.";"Faça este grande feito e você... será sempre lembrado como nosso maior Herói. Com certeza."
"c1e4dc48";"[coughs]";"[coughs]"
"c25df2fb";"You bloody fool! You dare turn your back on me? You'll pay for this. One day, you will pay for this!";"Seu idiota! Você ousa me dar as costas? Você vai pagar por isso. Um dia, você vai pagar por isso!"
"c2e26b38";"Now let us wait in silence while my good friend comes to a decision.";"Agora vamos esperar em silêncio enquanto meu bom amigo toma uma decisão."
"c3e28411";"I know you'll do the right thing.";"Eu sei que você fará a coisa certa."
"c4e5f19e";"Join me now. What are you waiting for?";"Junte-se a mim agora. O que você está esperando?"
"c5e1c720";"And who's going to lead them if not me? You? A mere shop keeper?";"E quem vai liderá-los se não eu? Você? Um mero lojista?"
"c6e4baaa";"You don't deserve that power. You've pushed us around long enough.";"Você não merece esse poder. Você já nos humilhou por tempo demais."
"c7e3d020";"You're not stupid. You know where the power lies.";"Você não é estúpido. Você sabe onde reside o poder."
"c8e61570";"Don't let him bully us around anymore!";"Não deixem ele nos intimidar mais!"
"c9e1bfae";"Yes, help us! We want control over our lives!";"Sim, nos ajude! Queremos ter controle sobre nossas vidas!"
"cb5c7c45";"Well, the submarine is fixed. Ready to come with me to Knothole Island? People are still freezing to death.";"Bem, o submarino está consertado. Pronto para vir comigo para a Ilha do Buraco da Árvore? As pessoas ainda estão morrendo congeladas."
"d04b3b90";"You will get the Ice Totem from the Storm Shrine then?";"Você conseguirá o Totem de Gelo no Santuário da Tempestade então?"
"d44d1a5d";"Join the Chieftain and receive 10,000 gold pieces.";"Junte-se ao Chefe e receba 10.000 peças de ouro."
"d62ca20a";"Talk to the Chieftain.";"Fale com o Chefe."
"d62ca20b";"Dig up the Ice Key.";"Desenterre a Chave de Gelo."
"d62ca20c";"Enter the shrine and activate the totem.";"Entre no santuário e ative o totem."
"d62d9567";"Return to the Chieftain.";"Retorne ao Chefe."
"df1c6337";"Knothole Island is suffering from an endless storm.";"A Ilha do Buraco da Nó está sofrendo com uma tempestade sem fim."
"e1ccca2c";"Glad to see you're not a fool. This island is mine and always will be. Here's your reward. And feel free to enter the Weather Chamber when you please.";"Que bom que você não é tolo. Esta ilha é minha e sempre será. Aqui está sua recompensa. E sinta-se à vontade para entrar na Câmara do Tempo quando quiser."
"e6cc7c51";"Knothole Island's Huge Heat";"O Calor Intenso da Ilha Knothole"
"ee0e4028";"You carried out your instructions well, and I commend you. Consider the new shopping opportunities to be your reward.";"Você cumpriu bem as instruções, e eu te parabenizo. Considere as novas oportunidades de compras como sua recompensa."
"ef0bf1c2";"Now I must oversee the collection of water and make sure everybody pays the proper rain toll.";"Agora preciso supervisionar a coleta de água e garantir que todos paguem o pedágio da chuva corretamente."
"f10b1734";"Oh, rain, glorious rain! I've saved the island once again. All thanks to the cunning guidance I've offered you.";"Oh, chuva, chuva gloriosa! Salvei a ilha mais uma vez. Tudo graças à astuta orientação que lhe ofereci."
"f6b20d22";"A mysterious figure has appeared in the Bowerstone docks.";"Uma figura misteriosa apareceu nos cais de Bowerstone."
"f87d7014";"Use the Sun Totem?";"Usar o Totem do Sol?"
"fcec542c";"Return to the Chieftain.";"Retorne ao Chefe."
"fcec542d";"Enter the shrine and activate the totem.";"Entre no santuário e ative o totem."
"fcec542e";"Dig up the Sun Key.";"Desenterre a Chave do Sol."
"fcecfe14";"Talk to the Chieftain.";"Fale com o Chefe."
